{
  "schema": "capital.authorization/v2",
  "authorization_id": "auth-funding-v2-001",
  "project_id": "project-001",
  "decision": "APPROVED",
  "decision_authority": "MULTISIG_GOVERNANCE",
  "funding_asset": "USDC",
  "approved_amount": "1000",
  "funding_source_id": "sinergy-capital-account",
  "funding_destination_id": "project-001-escrow",
  "payment_idempotency_key": "capital-project-001-auth-v2-001",
  "payment_purpose": "productive_capital_funding",
  "usage_policy": "SINGLE_EXACT_PAYMENT",
  "screening_digest": "aaaaaaaaaaaaaaaaaaaaaaaaaaaaaaaaaaaaaaaaaaaaaaaaaaaaaaaaaaaaaaaa",
  "financial_snapshot_digest": "bbbbbbbbbbbbbbbbbbbbbbbbbbbbbbbbbbbbbbbbbbbbbbbbbbbbbbbbbbbbbbbb",
  "financial_snapshot_sequence": 42,
  "valuation_policy_digest": "cccccccccccccccccccccccccccccccccccccccccccccccccccccccccccccccc",
  "requirement_registry_digest": "dddddddddddddddddddddddddddddddddddddddddddddddddddddddddddddddd",
  "decision_evidence_digest": "eeeeeeeeeeeeeeeeeeeeeeeeeeeeeeeeeeeeeeeeeeeeeeeeeeeeeeeeeeeeeeee",
  "approver_policy_digest": "ffffffffffffffffffffffffffffffffffffffffffffffffffffffffffffffff",
  "notes_digest": null,
  "decided_at": "2026-08-18T19:00:00Z",
  "expires_at": "2026-08-18T21:00:00Z",
  "execution_authority": "SEPARATE_METAPAY_HANDOFF",
  "ai_authority": "NONE",
  "digest": "1e814153a18850865543e08b498b60d9bce80dbd34bfb2f4c378f3fe502fe89f"
}
